{"active_implementation_sections":[],"authorization_id":null,"base_checkpoint":null,"dimensions":{"acceptance":"PENDING","authority":"NO_ACTIVE_WORK_AUTHORIZATION","closeout":"NOT_PROPOSED","final_closure":"OPEN","implementation":"NOT_STARTED","migration":"NONE","roadmap":"ONBOARDING_REQUIRED","verification":"NOT_STARTED","work_package":"NOT_ACCEPTED"},"evidence":["Deterministic project control-state template","No implementation authority granted during initialization"],"section":null,"state_id":"LC-ONBOARDING-REQUIRED"}
